"text-bolt-elements-textTertiary","flex","flex href","flex 2","flex href 2","flex 3","flex href 3","flex 4","flex href 4","flex 5","flex href 5"
"Yesterday","Start Vite development server","https://bolt.new/p/42405526","","","","","","","",""
"Thursday","Blank (forked)","https://bolt.new/p/42318869","AffinityLove Relationship Platform","https://bolt.new/p/42133500","","","","","",""
"Wednesday","Set up Crypto Social Analysis Dashboard","https://bolt.new/p/42298035","","","","","","","",""
"Tuesday","Plateforme d'optimisation SEO et SEA","https://bolt.new/p/42125791","","","","","","","",""
"Sunday","Connect to Supabase","https://bolt.new/p/41035130","","","","","","","",""
"Last 30 Days","SEO Tools Dashboard","https://bolt.new/p/41921168","Web3 Fitness Tracking Application","https://bolt.new/p/41880621","Enhanced Portfolio with SEO Optimization","https://bolt.new/p/41510209","SaaS Chatbot Platform Features","https://bolt.new/p/33565391","Initial Supabase Setup","https://bolt.new/p/41085922"
"January","Dashboard Initial Setup","https://bolt.new/p/33484971","AI Dashboard Setup","https://bolt.new/p/37334976","","","","","",""
"December 2024","FixieRun Landing Page Implementation","https://bolt.new/p/37228149","Fixie.run Lite Paper","https://bolt.new/p/37072501","Optimisation SEO pour FixieRun","https://bolt.new/p/36586537","Node.js Multisite Management System","https://bolt.new/p/33420073","Start Development Server","https://bolt.new/p/34711718"
"November 2024","Node.js WordPress Management Alternative","https://bolt.new/p/33640117","Simple Task Management System","https://bolt.new/p/33638914","WordPress Deployment Interface","https://bolt.new/p/33552944","WordPress Deployment Manager Web Application","https://bolt.new/p/33486350","WordPress Deployment Interface","https://bolt.new/p/33479559"